{
  "schema_version": "0.8",
  "disease_id": "metronidazole_induced_encephalopathy",
  "disease_name": {
    "ja": "メトロニダゾール脳症",
    "en": "Metronidazole-induced encephalopathy"
  },
  "disease_aliases": {
    "ja": [
      "メトロニダゾール脳症"
    ],
    "en": [
      "Metronidazole-induced encephalopathy"
    ]
  },
  "clinical": {
    "overview": "メトロニダゾール曝露に関連する可逆性中毒性脳症。",
    "treatment": "原因薬剤中止と支持療法を行う。",
    "epidemiology": "長期または高用量投与例で問題となる。"
  },
  "demographics": {
    "sex": {
      "applicable": [
        "any"
      ],
      "predominance": "none",
      "predilection": "no_sex_predilection",
      "summary": "明らかな性差は限定的。"
    },
    "age": {
      "typical_min": 0,
      "typical_max": 100,
      "peak_decade": "薬剤曝露に依存",
      "summary": "0-100歳に多い。"
    }
  },
  "keywords": [
    "dentate nucleus",
    "drug toxicity"
  ],
  "frequency": {
    "label": "rare",
    "prevalence_rank": 2,
    "basis": "differential_importance",
    "evidence_level": "public_review",
    "context": {
      "population": "any",
      "body_region": "brain",
      "clinical_setting": "toxic encephalopathy"
    },
    "summary": "toxic encephalopathyの鑑別として重要。"
  },
  "imaging": {
    "ct": {
      "summary": "CTは正常のことが多い。",
      "findings_by_phase": [
        {
          "phase": {
            "code": "non_contrast"
          },
          "findings": [
            {
              "finding_code": "finding:ct_isoattenuation",
              "modality": "CT",
              "acquisition": {
                "type": "phase",
                "code": "non_contrast"
              },
              "anatomy": {
                "body_region": "brain",
                "organ": "brain",
                "subregion": "brain",
                "laterality": "unknown"
              },
              "target": "lesion",
              "modifiers": {},
              "keywords": [],
              "finding_text": "CTで明らかな異常を示さないことが多い。",
              "typicality": "common",
              "diagnostic_weight": 1,
              "review_status": "draft",
              "mapping": {
                "status": "matched",
                "confidence": 0.9,
                "matched_concept_id": "finding:ct_isoattenuation",
                "alternatives": []
              },
              "finding_id": "metronidazole_induced_encephalopathy_ct_001"
            }
          ]
        }
      ]
    },
    "mri": {
      "summary": "MRIでは小脳歯状核、脳梁、脳幹のT2/FLAIR高信号、DWI変化を評価する。",
      "findings_by_sequence": [
        {
          "sequence": {
            "code": "FLAIR"
          },
          "findings": [
            {
              "finding_code": "finding:flair_hyperintensity",
              "modality": "MRI",
              "acquisition": {
                "type": "sequence",
                "code": "FLAIR"
              },
              "anatomy": {
                "body_region": "brain",
                "organ": "brain",
                "subregion": "cerebellum",
                "laterality": "unknown"
              },
              "target": "lesion",
              "modifiers": {},
              "keywords": [],
              "finding_text": "小脳歯状核や脳幹にFLAIR高信号を示す。",
              "typicality": "common",
              "diagnostic_weight": 5,
              "review_status": "draft",
              "mapping": {
                "status": "matched",
                "confidence": 0.9,
                "matched_concept_id": "finding:flair_hyperintensity",
                "alternatives": []
              },
              "finding_id": "metronidazole_induced_encephalopathy_mri_002"
            },
            {
              "finding_code": "finding:callosal_lesion",
              "modality": "MRI",
              "acquisition": {
                "type": "sequence",
                "code": "FLAIR"
              },
              "anatomy": {
                "body_region": "brain",
                "organ": "brain",
                "subregion": "brain",
                "laterality": "unknown"
              },
              "target": "lesion",
              "modifiers": {},
              "keywords": [],
              "finding_text": "脳梁病変を伴うことがある。",
              "typicality": "variable",
              "diagnostic_weight": 3,
              "review_status": "draft",
              "mapping": {
                "status": "matched",
                "confidence": 0.9,
                "matched_concept_id": "finding:callosal_lesion",
                "alternatives": []
              },
              "finding_id": "metronidazole_induced_encephalopathy_mri_003"
            }
          ]
        },
        {
          "sequence": {
            "code": "DWI"
          },
          "findings": [
            {
              "finding_code": "finding:dwi_hyperintensity",
              "modality": "MRI",
              "acquisition": {
                "type": "sequence",
                "code": "DWI"
              },
              "anatomy": {
                "body_region": "brain",
                "organ": "brain",
                "subregion": "brain",
                "laterality": "unknown"
              },
              "target": "lesion",
              "modifiers": {},
              "keywords": [],
              "finding_text": "DWI高信号を伴うことがある。",
              "typicality": "variable",
              "diagnostic_weight": 3,
              "review_status": "draft",
              "mapping": {
                "status": "matched",
                "confidence": 0.9,
                "matched_concept_id": "finding:dwi_hyperintensity",
                "alternatives": []
              },
              "finding_id": "metronidazole_induced_encephalopathy_mri_004"
            }
          ]
        },
        {
          "sequence": {
            "code": "contrast_enhanced_T1WI"
          },
          "findings": [
            {
              "finding_code": "finding:enhancement_absent",
              "modality": "MRI",
              "acquisition": {
                "type": "sequence",
                "code": "contrast_enhanced_T1WI"
              },
              "anatomy": {
                "body_region": "brain",
                "organ": "brain",
                "subregion": "brain",
                "laterality": "unknown"
              },
              "target": "lesion",
              "modifiers": {},
              "keywords": [],
              "finding_text": "通常、明らかな造影効果は乏しい。",
              "typicality": "common",
              "diagnostic_weight": 2,
              "review_status": "draft",
              "mapping": {
                "status": "matched",
                "confidence": 0.9,
                "matched_concept_id": "finding:enhancement_absent",
                "alternatives": []
              },
              "finding_id": "metronidazole_induced_encephalopathy_mri_005"
            }
          ]
        }
      ]
    }
  },
  "evidence": {
    "summary": "PubMed?????????NCBI Bookshelf/StatPearls?NIH/NINDS?MedlinePlus?CDC?PMC open-access review??????",
    "claim_map": [
      {
        "claim_type": "imaging_findings",
        "finding_ids": [
          "metronidazole_induced_encephalopathy_ct_001",
          "metronidazole_induced_encephalopathy_mri_002",
          "metronidazole_induced_encephalopathy_mri_003",
          "metronidazole_induced_encephalopathy_mri_004",
          "metronidazole_induced_encephalopathy_mri_005"
        ],
        "claim_scope": [
          "finding_text",
          "typicality",
          "diagnostic_weight"
        ],
        "source_ids": [
          "public_brain_batch4_20260625"
        ],
        "confidence": "medium"
      }
    ]
  },
  "image_examples": [],
  "references": [
    {
      "source_id": "public_brain_batch4_20260625",
      "type": "public_source_packet",
      "title": "Public neuroradiology source packet for brain draft batch 4",
      "authors": [],
      "journal": "",
      "year": "2026",
      "url": "https://www.ncbi.nlm.nih.gov/books/",
      "license": "Public web source index: NCBI Bookshelf/StatPearls, NIH/NINDS, MedlinePlus, CDC, and open-access PMC review articles where applicable"
    },
    {
      "source_id": "public_raw_findings_audit_20260705",
      "type": "public_source_packet",
      "title": "Public neuroradiology raw-finding audit packet",
      "authors": [],
      "journal": "",
      "year": "2026",
      "url": "https://www.ncbi.nlm.nih.gov/books/",
      "license": "Public web source index: NCBI Bookshelf/StatPearls, NINDS, MedlinePlus, Radiopaedia-style named-sign review targets, and open-access review articles where applicable"
    }
  ],
  "review": {
    "status": "draft",
    "reviewed_by": "",
    "reviewed_at": "",
    "confidence": "low",
    "notes": "Brain field Phase1 batch4 draft."
  },
  "curation": {
    "auto_update_allowed": true,
    "locked_fields": [],
    "notes": ""
  },
  "provenance": {
    "created_by": "codex_public_source_review",
    "model": "codex",
    "created_at": "2026-06-25T11:51:30.202Z",
    "prompt_version": "brain_batch4_v0.1",
    "source_query": "Metronidazole-induced encephalopathy CT MRI imaging findings public source"
  },
  "updated_at": "2026-07-05T05:05:37.649Z",
  "content_hash": "",
  "raw_findings": []
}
