{
  "schema_version": "0.8",
  "disease_id": "laminar_cortical_necrosis",
  "disease_name": {
    "ja": "皮質層状壊死",
    "en": "Cortical laminar necrosis"
  },
  "disease_aliases": {
    "ja": [
      "皮質層状壊死"
    ],
    "en": [
      "Cortical laminar necrosis"
    ]
  },
  "clinical": {
    "overview": "低酸素、低血糖、痙攣重積、梗塞後などで皮質層状に壊死を来す。",
    "treatment": "原因病態の治療と神経学的管理を行う。",
    "epidemiology": "虚血性・代謝性・発作関連障害の後に見られる。"
  },
  "demographics": {
    "sex": {
      "applicable": [
        "any"
      ],
      "predominance": "none",
      "predilection": "no_sex_predilection",
      "summary": "明らかな性差は限定的。"
    },
    "age": {
      "typical_min": 0,
      "typical_max": 100,
      "peak_decade": "原因に依存",
      "summary": "0-100歳に多い。"
    }
  },
  "keywords": [
    "cortical ribbon",
    "laminar necrosis"
  ],
  "frequency": {
    "label": "uncommon",
    "prevalence_rank": 3,
    "basis": "differential_importance",
    "evidence_level": "public_review",
    "context": {
      "population": "any",
      "body_region": "brain",
      "clinical_setting": "cortical injury"
    },
    "summary": "cortical injuryの鑑別として重要。"
  },
  "imaging": {
    "ct": {
      "summary": "CTでは皮質浮腫や低吸収として見えることがある。",
      "findings_by_phase": [
        {
          "phase": {
            "code": "non_contrast"
          },
          "findings": [
            {
              "finding_code": "finding:ct_hypoattenuation",
              "modality": "CT",
              "acquisition": {
                "type": "phase",
                "code": "non_contrast"
              },
              "anatomy": {
                "body_region": "brain",
                "organ": "brain",
                "subregion": "brain",
                "laterality": "unknown"
              },
              "target": "lesion",
              "modifiers": {},
              "keywords": [],
              "finding_text": "CTで皮質低吸収/浮腫を示すことがある。",
              "typicality": "common",
              "diagnostic_weight": 2,
              "review_status": "draft",
              "mapping": {
                "status": "matched",
                "confidence": 0.9,
                "matched_concept_id": "finding:ct_hypoattenuation",
                "alternatives": []
              },
              "finding_id": "laminar_cortical_necrosis_ct_001"
            }
          ]
        }
      ]
    },
    "mri": {
      "summary": "MRIでは皮質リボン状FLAIR高信号、DWI高信号、亜急性期T1高信号を評価する。",
      "findings_by_sequence": [
        {
          "sequence": {
            "code": "FLAIR"
          },
          "findings": [
            {
              "finding_code": "finding:cortical_laminar_necrosis",
              "modality": "MRI",
              "acquisition": {
                "type": "sequence",
                "code": "FLAIR"
              },
              "anatomy": {
                "body_region": "brain",
                "organ": "brain",
                "subregion": "brain",
                "laterality": "unknown"
              },
              "target": "lesion",
              "modifiers": {},
              "keywords": [],
              "finding_text": "皮質層状壊死として皮質リボン状異常信号を示す。",
              "typicality": "common",
              "diagnostic_weight": 5,
              "review_status": "draft",
              "mapping": {
                "status": "matched",
                "confidence": 0.9,
                "matched_concept_id": "finding:cortical_laminar_necrosis",
                "alternatives": []
              },
              "finding_id": "laminar_cortical_necrosis_mri_002"
            }
          ]
        },
        {
          "sequence": {
            "code": "DWI"
          },
          "findings": [
            {
              "finding_code": "finding:dwi_hyperintensity",
              "modality": "MRI",
              "acquisition": {
                "type": "sequence",
                "code": "DWI"
              },
              "anatomy": {
                "body_region": "brain",
                "organ": "brain",
                "subregion": "brain",
                "laterality": "unknown"
              },
              "target": "lesion",
              "modifiers": {},
              "keywords": [],
              "finding_text": "急性期にDWI高信号を示すことがある。",
              "typicality": "common",
              "diagnostic_weight": 4,
              "review_status": "draft",
              "mapping": {
                "status": "matched",
                "confidence": 0.9,
                "matched_concept_id": "finding:dwi_hyperintensity",
                "alternatives": []
              },
              "finding_id": "laminar_cortical_necrosis_mri_003"
            }
          ]
        },
        {
          "sequence": {
            "code": "ADC"
          },
          "findings": [
            {
              "finding_code": "finding:adc_low",
              "modality": "MRI",
              "acquisition": {
                "type": "sequence",
                "code": "ADC"
              },
              "anatomy": {
                "body_region": "brain",
                "organ": "brain",
                "subregion": "brain",
                "laterality": "unknown"
              },
              "target": "lesion",
              "modifiers": {},
              "keywords": [],
              "finding_text": "急性期はADC低値を伴うことがある。",
              "typicality": "common",
              "diagnostic_weight": 3,
              "review_status": "draft",
              "mapping": {
                "status": "matched",
                "confidence": 0.9,
                "matched_concept_id": "finding:adc_low",
                "alternatives": []
              },
              "finding_id": "laminar_cortical_necrosis_mri_004"
            }
          ]
        },
        {
          "sequence": {
            "code": "T1WI"
          },
          "findings": [
            {
              "finding_code": "finding:t1_hyperintensity",
              "modality": "MRI",
              "acquisition": {
                "type": "sequence",
                "code": "T1WI"
              },
              "anatomy": {
                "body_region": "brain",
                "organ": "brain",
                "subregion": "brain",
                "laterality": "unknown"
              },
              "target": "lesion",
              "modifiers": {},
              "keywords": [],
              "finding_text": "亜急性期に皮質T1高信号を示す。",
              "typicality": "common",
              "diagnostic_weight": 5,
              "review_status": "draft",
              "mapping": {
                "status": "matched",
                "confidence": 0.9,
                "matched_concept_id": "finding:t1_hyperintensity",
                "alternatives": []
              },
              "finding_id": "laminar_cortical_necrosis_mri_005"
            }
          ]
        }
      ]
    }
  },
  "evidence": {
    "summary": "PubMed?????????NCBI Bookshelf/StatPearls?NIH/NINDS?MedlinePlus?CDC?PMC open-access review??????",
    "claim_map": [
      {
        "claim_type": "imaging_findings",
        "finding_ids": [
          "laminar_cortical_necrosis_ct_001",
          "laminar_cortical_necrosis_mri_002",
          "laminar_cortical_necrosis_mri_003",
          "laminar_cortical_necrosis_mri_004",
          "laminar_cortical_necrosis_mri_005"
        ],
        "claim_scope": [
          "finding_text",
          "typicality",
          "diagnostic_weight"
        ],
        "source_ids": [
          "public_brain_batch4_20260625"
        ],
        "confidence": "medium"
      }
    ]
  },
  "image_examples": [],
  "references": [
    {
      "source_id": "public_brain_batch4_20260625",
      "type": "public_source_packet",
      "title": "Public neuroradiology source packet for brain draft batch 4",
      "authors": [],
      "journal": "",
      "year": "2026",
      "url": "https://www.ncbi.nlm.nih.gov/books/",
      "license": "Public web source index: NCBI Bookshelf/StatPearls, NIH/NINDS, MedlinePlus, CDC, and open-access PMC review articles where applicable"
    },
    {
      "source_id": "public_raw_findings_audit_20260705",
      "type": "public_source_packet",
      "title": "Public neuroradiology raw-finding audit packet",
      "authors": [],
      "journal": "",
      "year": "2026",
      "url": "https://www.ncbi.nlm.nih.gov/books/",
      "license": "Public web source index: NCBI Bookshelf/StatPearls, NINDS, MedlinePlus, Radiopaedia-style named-sign review targets, and open-access review articles where applicable"
    }
  ],
  "review": {
    "status": "draft",
    "reviewed_by": "",
    "reviewed_at": "",
    "confidence": "low",
    "notes": "Brain field Phase1 batch4 draft."
  },
  "curation": {
    "auto_update_allowed": true,
    "locked_fields": [],
    "notes": ""
  },
  "provenance": {
    "created_by": "codex_public_source_review",
    "model": "codex",
    "created_at": "2026-06-25T11:51:30.202Z",
    "prompt_version": "brain_batch4_v0.1",
    "source_query": "Cortical laminar necrosis CT MRI imaging findings public source"
  },
  "updated_at": "2026-07-05T05:05:37.649Z",
  "content_hash": "",
  "raw_findings": []
}
